### ISSUE TITLE
edge on the Internet can connect to the supernode

### ISSUE THREAD

**Issue by ileeoyo** [ntop/n2n#245]
i run a supernode in my openwrt router,but my computer running a edge can not get a connection.
there is something strange，two edges has the same ip and port.one edge on the interent can not get response，one edge in LAN look normal
![image](https://user-images.githubusercontent.com/24651612/82018994-f4986b80-96b8-11ea-9a1b-0695db410588.png)

**Comment by Logan007** [comment]
What are the exact command lines (including the options) you invoke the edges with?

What does your network setup look like? Does the router maybe have firewall for incoming external connections?

**Comment by ileeoyo** [comment]
> What are the exact command lines (including the options) you invoke the edges with?
> 
> What does your network setup look like? Does the router maybe have firewall for incoming external connections?

```
/usr/sbin/supernode -l 9994 -v
```

```
 sudo edge -a static:10.0.0.30 -c example -k $password -s 255.255.255.0 -l $domain:9994 -f
```

*192.168.2.2* is my main router lan ip,i ran a supernode on annother router which has ip *192.168.2.4* .there is a port forwarding for port 9994 on my main router
the router running a supernode accept all packet from lan

**Comment by Logan007** [comment]
> 192.168.2.2 is my main router lan ip,i ran a supernode on annother router which has ip 192.168.2.4. there is a port forwarding for port 9994 on my main router

That would explain why the IP is the same for both edges; I guess the 192.168.2.2 router does port forwarding, using another internal port (48357) to forward the packets from external port (9994). 

Also, I guess that `$domain` is numeric IP.

I am not sure how to interpret the two different MACs. They seem to indicate the two different `edge`s. You could use `-m <MAC>` with some fixed different MACs on both external edges, just to better distinguish them in the supernode's output. Otherwise, the syntax looks good. The only difference from my well working setup is that I do not use `static:` prefix with `-a` (but that should not be an issue). I do not dare to mention – but, did you use distinct IP addresses for both edges?

Do you get any more hints from external `edge`'s verbose output `edge ... -vvvvv` ?

**Comment by ileeoyo** [comment]
$domain is a domain name.
here is some edge's log
```
17/May/2020 09:55:44 [edge.c:606] Starting n2n edge 2.4 May  7 2020 17:23:52
17/May/2020 09:55:44 [edge.c:609] supernode 0 => $domain:9994
17/May/2020 09:55:45 [edge.c:649] ip_mode='static'
17/May/2020 09:55:45 [tuntap_linux.c:120] Bringing up: /sbin/ifconfig edge0 10.0.0.30 netmask 255.255.255.0 mtu 1400 up
17/May/2020 09:55:45 [tuntap_linux.c:43] Interface edge0 has MAC B6:37:F4:88:EC:F9
17/May/2020 09:55:45 [edge.c:694] edge started
17/May/2020 09:55:45 [edge_utils.c:485] send REGISTER_SUPER to $supernodeip:9994
17/May/2020 09:55:55 [transform_aes.c:447] transop_aes no keys are currently valid. Keeping tx_sa=0
17/May/2020 09:55:55 [transform_tf.c:361] transop_tf choosing tx_sa=0 (valid for 557803092 sec)
17/May/2020 09:55:55 [edge_utils.c:671] Chose new tx_transop_idx=1
17/May/2020 09:55:55 [edge_utils.c:485] send REGISTER_SUPER to $supernodeip:9994
17/May/2020 09:55:55 [n2n.c:317] Purging old registrations
17/May/2020 09:55:55 [n2n.c:322] Remove 0 registrations
17/May/2020 09:56:05 [edge_utils.c:485] send REGISTER_SUPER to $supernodeip:9994
17/May/2020 09:56:14 [transform_aes.c:447] transop_aes no keys are currently valid. Keeping tx_sa=0
17/May/2020 09:56:14 [transform_tf.c:361] transop_tf choosing tx_sa=0 (valid for 557803073 sec)
17/May/2020 09:56:14 [edge_utils.c:1181] ### Rx TAP packet (  42) for FF:FF:FF:FF:FF:FF
17/May/2020 09:56:14 [edge_utils.c:1066] send_packet to $supernodeip:9994
17/May/2020 09:56:14 [edge_utils.c:587] WARNING: Supernode not responding - moving to 0 of 1
17/May/2020 09:56:14 [edge_utils.c:485] send REGISTER_SUPER to $supernodeip:9994
17/May/2020 09:56:15 [edge_utils.c:1181] ### Rx TAP packet (  42) for FF:FF:FF:FF:FF:FF
17/May/2020 09:56:15 [edge_utils.c:1066] send_packet to $supernodeip:9994
17/May/2020 09:56:16 [edge_utils.c:1181] ### Rx TAP packet (  42) for FF:FF:FF:FF:FF:FF
17/May/2020 09:56:16 [edge_utils.c:1066] send_packet to $supernodeip:9994
17/May/2020 09:56:19 [edge_utils.c:1181] ### Rx TAP packet (  42) for FF:FF:FF:FF:FF:FF
17/May/2020 09:56:19 [edge_utils.c:1066] send_packet to $supernodeip:9994
17/May/2020 09:56:19 [edge_utils.c:1181] ### Rx TAP packet (  42) for FF:FF:FF:FF:FF:FF
17/May/2020 09:56:19 [edge_utils.c:1066] send_packet to $supernodeip:9994
17/May/2020 09:56:19 [edge_utils.c:1181] ### Rx TAP packet (  42) for FF:FF:FF:FF:FF:FF
17/May/2020 09:56:19 [edge_utils.c:1066] send_packet to $supernodeip:9994
17/May/2020 09:56:19 [edge_utils.c:1181] ### Rx TAP packet (  42) for FF:FF:FF:FF:FF:FF
17/May/2020 09:56:19 [edge_utils.c:1066] send_packet to $supernodeip:9994
17/May/2020 09:56:20 [edge_utils.c:1181] ### Rx TAP packet (  42) for FF:FF:FF:FF:FF:FF
17/May/2020 09:56:20 [edge_utils.c:1066] send_packet to $supernodeip:9994
17/May/2020 09:56:20 [edge_utils.c:1181] ### Rx TAP packet (  42) for FF:FF:FF:FF:FF:FF
17/May/2020 09:56:20 [edge_utils.c:1066] send_packet to $supernodeip:9994
17/May/2020 09:56:20 [edge_utils.c:1181] ### Rx TAP packet (  42) for FF:FF:FF:FF:FF:FF
17/May/2020 09:56:20 [edge_utils.c:1066] send_packet to $supernodeip:9994
17/May/2020 09:56:20 [edge_utils.c:1181] ### Rx TAP packet (  42) for FF:FF:FF:FF:FF:FF
17/May/2020 09:56:20 [edge_utils.c:1066] send_packet to $supernodeip:9994
17/May/2020 09:56:21 [edge_utils.c:1181] ### Rx TAP packet (  42) for FF:FF:FF:FF:FF:FF
17/May/2020 09:56:21 [edge_utils.c:1066] send_packet to $supernodeip:9994
17/May/2020 09:56:21 [edge_utils.c:485] send REGISTER_SUPER to $supernodeip:9994
17/May/2020 09:56:21 [edge_utils.c:1181] ### Rx TAP packet (  42) for FF:FF:FF:FF:FF:FF
17/May/2020 09:56:21 [edge_utils.c:1066] send_packet to $supernodeip:9994
17/May/2020 09:56:21 [edge_utils.c:1181] ### Rx TAP packet (  42) for FF:FF:FF:FF:FF:FF
17/May/2020 09:56:21 [edge_utils.c:1066] send_packet to $supernodeip:9994
17/May/2020 09:56:21 [edge_utils.c:1181] ### Rx TAP packet (  42) for FF:FF:FF:FF:FF:FF
17/May/2020 09:56:21 [edge_utils.c:1066] send_packet to $supernodeip:9994
17/May/2020 09:56:24 [edge_utils.c:1181] ### Rx TAP packet (  42) for FF:FF:FF:FF:FF:FF
17/May/2020 09:56:24 [edge_utils.c:1066] send_packet to $supernodeip:9994
17/May/2020 09:56:24 [edge_utils.c:1181] ### Rx TAP packet (  42) for FF:FF:FF:FF:FF:FF
17/May/2020 09:56:24 [edge_utils.c:1066] send_packet to $supernodeip:9994
17/May/2020 09:56:24 [edge_utils.c:1181] ### Rx TAP packet (  42) for FF:FF:FF:FF:FF:FF
17/May/2020 09:56:24 [edge_utils.c:1066] send_packet to $supernodeip:9994
17/May/2020 09:56:24 [edge_utils.c:1181] ### Rx TAP packet (  42) for FF:FF:FF:FF:FF:FF
17/May/2020 09:56:24 [edge_utils.c:1066] send_packet to $supernodeip:9994
17/May/2020 09:56:25 [transform_aes.c:447] transop_aes no keys are currently valid. Keeping tx_sa=0
17/May/2020 09:56:25 [transform_tf.c:361] transop_tf choosing tx_sa=0 (valid for 557803062 sec)
17/May/2020 09:56:25 [edge_utils.c:1181] ### Rx TAP packet (  42) for FF:FF:FF:FF:FF:FF
17/May/2020 09:56:25 [edge_utils.c:1066] send_packet to $supernodeip:9994
17/May/2020 09:56:25 [edge_utils.c:1181] ### Rx TAP packet (  42) for FF:FF:FF:FF:FF:FF
17/May/2020 09:56:25 [edge_utils.c:1066] send_packet to $supernodeip:9994
17/May/2020 09:56:25 [edge_utils.c:1181] ### Rx TAP packet (  42) for FF:FF:FF:FF:FF:FF
17/May/2020 09:56:25 [edge_utils.c:1066] send_packet to $supernodeip:9994
17/May/2020 09:56:25 [edge_utils.c:1181] ### Rx TAP packet (  42) for FF:FF:FF:FF:FF:FF
17/May/2020 09:56:25 [edge_utils.c:1066] send_packet to $supernodeip:9994
17/May/2020 09:56:26 [edge_utils.c:1181] ### Rx TAP packet (  42) for FF:FF:FF:FF:FF:FF
17/May/2020 09:56:26 [edge_utils.c:1066] send_packet to $supernodeip:9994
17/May/2020 09:56:26 [edge_utils.c:1181] ### Rx TAP packet (  42) for FF:FF:FF:FF:FF:FF
17/May/2020 09:56:26 [edge_utils.c:1066] send_packet to $supernodeip:9994
17/May/2020 09:56:26 [edge_utils.c:1181] ### Rx TAP packet (  42) for FF:FF:FF:FF:FF:FF
17/May/2020 09:56:26 [edge_utils.c:1066] send_packet to $supernodeip:9994
17/May/2020 09:56:26 [edge_utils.c:1181] ### Rx TAP packet (  42) for FF:FF:FF:FF:FF:FF
17/May/2020 09:56:26 [edge_utils.c:1066] send_packet to $supernodeip:9994
17/May/2020 09:56:34 [edge_utils.c:1181] ### Rx TAP packet (  42) for FF:FF:FF:FF:FF:FF
17/May/2020 09:56:34 [edge_utils.c:1066] send_packet to $supernodeip:9994
17/May/2020 09:56:34 [edge_utils.c:485] send REGISTER_SUPER to $supernodeip:9994
17/May/2020 09:56:34 [edge_utils.c:1181] ### Rx TAP packet (  42) for FF:FF:FF:FF:FF:FF
17/May/2020 09:56:34 [edge_utils.c:1066] send_packet to $supernodeip:9994
17/May/2020 09:56:34 [edge_utils.c:1181] ### Rx TAP packet (  42) for FF:FF:FF:FF:FF:FF
17/May/2020 09:56:34 [edge_utils.c:1066] send_packet to $supernodeip:9994
17/May/2020 09:56:34 [edge_utils.c:1181] ### Rx TAP packet (  42) for FF:FF:FF:FF:FF:FF
17/May/2020 09:56:34 [edge_utils.c:1066] send_packet to $supernodeip:9994
17/May/2020 09:56:35 [edge_utils.c:1181] ### Rx TAP packet (  42) for FF:FF:FF:FF:FF:FF
17/May/2020 09:56:35 [edge_utils.c:1066] send_packet to $supernodeip:9994
17/May/2020 09:56:35 [edge_utils.c:1181] ### Rx TAP packet (  42) for FF:FF:FF:FF:FF:FF
17/May/2020 09:56:35 [edge_utils.c:1066] send_packet to $supernodeip:9994
17/May/2020 09:56:35 [edge_utils.c:1181] ### Rx TAP packet (  42) for FF:FF:FF:FF:FF:FF
17/May/2020 09:56:35 [edge_utils.c:1066] send_packet to $supernodeip:9994
17/May/2020 09:56:35 [edge_utils.c:1181] ### Rx TAP packet (  42) for FF:FF:FF:FF:FF:FF
17/May/2020 09:56:35 [edge_utils.c:1066] send_packet to $supernodeip:9994
17/May/2020 09:56:36 [transform_aes.c:447] transop_aes no keys are currently valid. Keeping tx_sa=0
17/May/2020 09:56:36 [transform_tf.c:361] transop_tf choosing tx_sa=0 (valid for 557803051 sec)
17/May/2020 09:56:36 [edge_utils.c:1181] ### Rx TAP packet (  42) for FF:FF:FF:FF:FF:FF
17/May/2020 09:56:36 [edge_utils.c:1066] send_packet to $supernodeip:9994
17/May/2020 09:56:36 [edge_utils.c:1181] ### Rx TAP packet (  42) for FF:FF:FF:FF:FF:FF
17/May/2020 09:56:36 [edge_utils.c:1066] send_packet to $supernodeip:9994
17/May/2020 09:56:36 [edge_utils.c:1181] ### Rx TAP packet (  42) for FF:FF:FF:FF:FF:FF
17/May/2020 09:56:36 [edge_utils.c:1066] send_packet to $supernodeip:9994
17/May/2020 09:56:36 [edge_utils.c:1181] ### Rx TAP packet (  42) for FF:FF:FF:FF:FF:FF
17/May/2020 09:56:36 [edge_utils.c:1066] send_packet to $supernodeip:9994
17/May/2020 09:56:39 [edge_utils.c:1181] ### Rx TAP packet (  42) for FF:FF:FF:FF:FF:FF
17/May/2020 09:56:39 [edge_utils.c:1066] send_packet to $supernodeip:9994
17/May/2020 09:56:39 [edge_utils.c:1181] ### Rx TAP packet (  42) for FF:FF:FF:FF:FF:FF
17/May/2020 09:56:39 [edge_utils.c:1066] send_packet to $supernodeip:9994
17/May/2020 09:56:39 [edge_utils.c:1181] ### Rx TAP packet (  42) for FF:FF:FF:FF:FF:FF
17/May/2020 09:56:39 [edge_utils.c:1066] send_packet to $supernodeip:9994
17/May/2020 09:56:39 [edge_utils.c:1181] ### Rx TAP packet (  42) for FF:FF:FF:FF:FF:FF
17/May/2020 09:56:39 [edge_utils.c:1066] send_packet to $supernodeip:9994
17/May/2020 09:56:40 [edge_utils.c:1181] ### Rx TAP packet (  42) for FF:FF:FF:FF:FF:FF
17/May/2020 09:56:40 [edge_utils.c:1066] send_packet to $supernodeip:9994
17/May/2020 09:56:40 [edge_utils.c:1181] ### Rx TAP packet (  42) for FF:FF:FF:FF:FF:FF
17/May/2020 09:56:40 [edge_utils.c:1066] send_packet to $supernodeip:9994
17/May/2020 09:56:40 [edge_utils.c:1181] ### Rx TAP packet (  42) for FF:FF:FF:FF:FF:FF
17/May/2020 09:56:40 [edge_utils.c:1066] send_packet to $supernodeip:9994
17/May/2020 09:56:40 [edge_utils.c:1181] ### Rx TAP packet (  42) for FF:FF:FF:FF:FF:FF
17/May/2020 09:56:40 [edge_utils.c:1066] send_packet to $supernodeip:9994
17/May/2020 09:56:41 [edge_utils.c:1181] ### Rx TAP packet (  42) for FF:FF:FF:FF:FF:FF
17/May/2020 09:56:41 [edge_utils.c:1066] send_packet to $supernodeip:9994
17/May/2020 09:56:41 [edge_utils.c:485] send REGISTER_SUPER to $supernodeip:9994
17/May/2020 09:56:41 [edge_utils.c:1181] ### Rx TAP packet (  42) for FF:FF:FF:FF:FF:FF
17/May/2020 09:56:41 [edge_utils.c:1066] send_packet to $supernodeip:9994
17/May/2020 09:56:41 [edge_utils.c:1181] ### Rx TAP packet (  42) for FF:FF:FF:FF:FF:FF
17/May/2020 09:56:41 [edge_utils.c:1066] send_packet to $supernodeip:9994
17/May/2020 09:56:41 [edge_utils.c:1181] ### Rx TAP packet (  42) for FF:FF:FF:FF:FF:FF
17/May/2020 09:56:41 [edge_utils.c:1066] send_packet to $supernodeip:9994

```

**Comment by Logan007** [comment]
I see that you use version 2.4. That might explain some unusual errors in `edge`'s log, some if which I have not even found in the current code base anymore. Are you able to you upgrade to 2.6 or current dev?

**Comment by ileeoyo** [comment]
> I see that you use version 2.4. That might explain some unusual errors in `edge`'s log, some if which I have not even found in the current code base anymore. Are you able to you upgrade to 2.6 or current dev?

I've upgraded my edge to version 2.6
```
17/May/2020 16:53:05 [edge_utils.c:1943] Adding supernode[0] = $supernode_domain:9994
17/May/2020 16:53:05 [edge.c:678] Starting n2n edge 2.6.0 May 17 2020 16:42:41
17/May/2020 16:53:05 [edge.c:688] ip_mode='static'
17/May/2020 16:53:05 [tuntap_linux.c:200] Waiting for TAP interface to be up and running...
17/May/2020 16:53:05 [tuntap_linux.c:221] Interface is up and running
17/May/2020 16:53:05 [edge_utils.c:229] supernode 0 => $supernode_domain:9994
17/May/2020 16:53:05 [edge.c:724] Dropping privileges to uid=65534, gid=65534
17/May/2020 16:53:05 [edge.c:748] edge started
17/May/2020 16:53:05 [edge_utils.c:669] Successfully joined multicast group 224.0.0.68:1968
17/May/2020 16:53:05 [edge_utils.c:861] Registering with supernode [id: 1/1][$supernode_domain:9994][attempts left 2]
17/May/2020 16:53:05 [edge_utils.c:779] Send REGISTER to 224.0.0.68:1968
17/May/2020 16:53:15 [edge_utils.c:1246] Tx PACKET to $supernode_ip:9994 (dest=FF:FF:FF:FF:FF:FF) [85 B]
17/May/2020 16:53:15 [edge_utils.c:861] Registering with supernode [id: 1/1][$supernode_domain:9994][attempts left 1]
17/May/2020 16:53:15 [edge_utils.c:779] Send REGISTER to 224.0.0.68:1968
17/May/2020 16:53:15 [edge_utils.c:1246] Tx PACKET to $supernode_ip:9994 (dest=FF:FF:FF:FF:FF:FF) [85 B]
17/May/2020 16:53:15 [edge_utils.c:1246] Tx PACKET to $supernode_ip:9994 (dest=FF:FF:FF:FF:FF:FF) [85 B]
17/May/2020 16:53:15 [edge_utils.c:1246] Tx PACKET to $supernode_ip:9994 (dest=FF:FF:FF:FF:FF:FF) [85 B]
17/May/2020 16:53:16 [edge_utils.c:1246] Tx PACKET to $supernode_ip:9994 (dest=FF:FF:FF:FF:FF:FF) [85 B]
17/May/2020 16:53:16 [edge_utils.c:1246] Tx PACKET to $supernode_ip:9994 (dest=FF:FF:FF:FF:FF:FF) [85 B]
17/May/2020 16:53:16 [edge_utils.c:1246] Tx PACKET to $supernode_ip:9994 (dest=FF:FF:FF:FF:FF:FF) [85 B]
17/May/2020 16:53:16 [edge_utils.c:1246] Tx PACKET to $supernode_ip:9994 (dest=FF:FF:FF:FF:FF:FF) [85 B]
17/May/2020 16:53:17 [edge_utils.c:1246] Tx PACKET to $supernode_ip:9994 (dest=FF:FF:FF:FF:FF:FF) [85 B]
17/May/2020 16:53:17 [edge_utils.c:1246] Tx PACKET to $supernode_ip:9994 (dest=FF:FF:FF:FF:FF:FF) [85 B]
17/May/2020 16:53:17 [edge_utils.c:1246] Tx PACKET to $supernode_ip:9994 (dest=FF:FF:FF:FF:FF:FF) [85 B]
17/May/2020 16:53:17 [edge_utils.c:1246] Tx PACKET to $supernode_ip:9994 (dest=FF:FF:FF:FF:FF:FF) [85 B]
17/May/2020 16:53:20 [edge_utils.c:1246] Tx PACKET to $supernode_ip:9994 (dest=FF:FF:FF:FF:FF:FF) [85 B]
17/May/2020 16:53:20 [edge_utils.c:861] Registering with supernode [id: 1/1][$supernode_domain:9994][attempts left 0]
17/May/2020 16:53:20 [edge_utils.c:779] Send REGISTER to 224.0.0.68:1968
17/May/2020 16:53:20 [edge_utils.c:1246] Tx PACKET to $supernode_ip:9994 (dest=FF:FF:FF:FF:FF:FF) [85 B]
17/May/2020 16:53:20 [edge_utils.c:1246] Tx PACKET to $supernode_ip:9994 (dest=FF:FF:FF:FF:FF:FF) [85 B]
17/May/2020 16:53:20 [edge_utils.c:1246] Tx PACKET to $supernode_ip:9994 (dest=FF:FF:FF:FF:FF:FF) [85 B]
17/May/2020 16:53:20 [edge_utils.c:1246] Tx PACKET to $supernode_ip:9994 (dest=FF:FF:FF:FF:FF:FF) [85 B]
17/May/2020 16:53:21 [edge_utils.c:1246] Tx PACKET to $supernode_ip:9994 (dest=FF:FF:FF:FF:FF:FF) [85 B]
17/May/2020 16:53:21 [edge_utils.c:1246] Tx PACKET to $supernode_ip:9994 (dest=FF:FF:FF:FF:FF:FF) [85 B]
17/May/2020 16:53:21 [edge_utils.c:1246] Tx PACKET to $supernode_ip:9994 (dest=FF:FF:FF:FF:FF:FF) [85 B]
17/May/2020 16:53:21 [edge_utils.c:1246] Tx PACKET to $supernode_ip:9994 (dest=FF:FF:FF:FF:FF:FF) [85 B]
17/May/2020 16:53:21 [edge_utils.c:1246] Tx PACKET to $supernode_ip:9994 (dest=FF:FF:FF:FF:FF:FF) [85 B]
17/May/2020 16:53:22 [edge_utils.c:1246] Tx PACKET to $supernode_ip:9994 (dest=FF:FF:FF:FF:FF:FF) [85 B]
17/May/2020 16:53:22 [edge_utils.c:1246] Tx PACKET to $supernode_ip:9994 (dest=FF:FF:FF:FF:FF:FF) [85 B]
17/May/2020 16:53:22 [edge_utils.c:1246] Tx PACKET to $supernode_ip:9994 (dest=FF:FF:FF:FF:FF:FF) [85 B]
17/May/2020 16:53:22 [edge_utils.c:1246] Tx PACKET to $supernode_ip:9994 (dest=FF:FF:FF:FF:FF:FF) [85 B]
17/May/2020 16:53:22 [edge_utils.c:1246] Tx PACKET to $supernode_ip:9994 (dest=FF:FF:FF:FF:FF:FF) [85 B]
17/May/2020 16:53:25 [edge_utils.c:1246] Tx PACKET to $supernode_ip:9994 (dest=FF:FF:FF:FF:FF:FF) [85 B]
17/May/2020 16:53:25 [edge_utils.c:851] WARNING: Supernode not responding, now trying $supernode_domain:9994
17/May/2020 16:53:25 [edge_utils.c:861] Registering with supernode [id: 1/1][$supernode_domain:9994][attempts left 3]
17/May/2020 16:53:25 [edge_utils.c:779] Send REGISTER to 224.0.0.68:1968
17/May/2020 16:53:26 [edge_utils.c:1246] Tx PACKET to $supernode_ip:9994 (dest=FF:FF:FF:FF:FF:FF) [85 B]
17/May/2020 16:53:27 [edge_utils.c:1246] Tx PACKET to $supernode_ip:9994 (dest=FF:FF:FF:FF:FF:FF) [85 B]
17/May/2020 16:53:30 [edge_utils.c:1246] Tx PACKET to $supernode_ip:9994 (dest=FF:FF:FF:FF:FF:FF) [85 B]
17/May/2020 16:53:30 [edge_utils.c:861] Registering with supernode [id: 1/1][$supernode_domain:9994][attempts left 2]
17/May/2020 16:53:30 [edge_utils.c:779] Send REGISTER to 224.0.0.68:1968
17/May/2020 16:53:30 [edge_utils.c:1246] Tx PACKET to $supernode_ip:9994 (dest=FF:FF:FF:FF:FF:FF) [85 B]
17/May/2020 16:53:30 [edge_utils.c:1246] Tx PACKET to $supernode_ip:9994 (dest=FF:FF:FF:FF:FF:FF) [85 B]
17/May/2020 16:53:30 [edge_utils.c:1246] Tx PACKET to $supernode_ip:9994 (dest=FF:FF:FF:FF:FF:FF) [85 B]
17/May/2020 16:53:31 [edge_utils.c:1246] Tx PACKET to $supernode_ip:9994 (dest=FF:FF:FF:FF:FF:FF) [85 B]
17/May/2020 16:53:31 [edge_utils.c:1246] Tx PACKET to $supernode_ip:9994 (dest=FF:FF:FF:FF:FF:FF) [85 B]
17/May/2020 16:53:31 [edge_utils.c:1246] Tx PACKET to $supernode_ip:9994 (dest=FF:FF:FF:FF:FF:FF) [85 B]
17/May/2020 16:53:31 [edge_utils.c:1246] Tx PACKET to $supernode_ip:9994 (dest=FF:FF:FF:FF:FF:FF) [85 B]
17/May/2020 16:53:32 [edge_utils.c:1246] Tx PACKET to $supernode_ip:9994 (dest=FF:FF:FF:FF:FF:FF) [85 B]
17/May/2020 16:53:32 [edge_utils.c:1246] Tx PACKET to $supernode_ip:9994 (dest=FF:FF:FF:FF:FF:FF) [85 B]
17/May/2020 16:53:32 [edge_utils.c:1246] Tx PACKET to $supernode_ip:9994 (dest=FF:FF:FF:FF:FF:FF) [85 B]
17/May/2020 16:53:32 [edge_utils.c:1246] Tx PACKET to $supernode_ip:9994 (dest=FF:FF:FF:FF:FF:FF) [85 B]
17/May/2020 16:53:35 [edge_utils.c:1246] Tx PACKET to $supernode_ip:9994 (dest=FF:FF:FF:FF:FF:FF) [85 B]
17/May/2020 16:53:35 [edge_utils.c:861] Registering with supernode [id: 1/1][$supernode_domain:9994][attempts left 1]
17/May/2020 16:53:35 [edge_utils.c:779] Send REGISTER to 224.0.0.68:1968
17/May/2020 16:53:35 [edge_utils.c:1246] Tx PACKET to $supernode_ip:9994 (dest=FF:FF:FF:FF:FF:FF) [85 B]
17/May/2020 16:53:35 [edge_utils.c:1246] Tx PACKET to $supernode_ip:9994 (dest=FF:FF:FF:FF:FF:FF) [85 B]
17/May/2020 16:53:36 [edge_utils.c:1246] Tx PACKET to $supernode_ip:9994 (dest=FF:FF:FF:FF:FF:FF) [85 B]
17/May/2020 16:53:36 [edge_utils.c:1246] Tx PACKET to $supernode_ip:9994 (dest=FF:FF:FF:FF:FF:FF) [85 B]
17/May/2020 16:53:36 [edge_utils.c:1246] Tx PACKET to $supernode_ip:9994 (dest=FF:FF:FF:FF:FF:FF) [85 B]
17/May/2020 16:53:37 [edge_utils.c:1246] Tx PACKET to $supernode_ip:9994 (dest=FF:FF:FF:FF:FF:FF) [85 B]
17/May/2020 16:53:37 [edge_utils.c:1246] Tx PACKET to $supernode_ip:9994 (dest=FF:FF:FF:FF:FF:FF) [85 B]
17/May/2020 16:53:37 [edge_utils.c:1246] Tx PACKET to $supernode_ip:9994 (dest=FF:FF:FF:FF:FF:FF) [85 B]
17/May/2020 16:53:40 [edge_utils.c:1246] Tx PACKET to $supernode_ip:9994 (dest=FF:FF:FF:FF:FF:FF) [85 B]
17/May/2020 16:53:40 [edge_utils.c:861] Registering with supernode [id: 1/1][$supernode_domain:9994][attempts left 0]
17/May/2020 16:53:40 [edge_utils.c:779] Send REGISTER to 224.0.0.68:1968
17/May/2020 16:53:41 [edge_utils.c:1246] Tx PACKET to $supernode_ip:9994 (dest=FF:FF:FF:FF:FF:FF) [85 B]
17/May/2020 16:53:42 [edge_utils.c:1246] Tx PACKET to $supernode_ip:9994 (dest=FF:FF:FF:FF:FF:FF) [85 B]
17/May/2020 16:53:45 [edge_utils.c:1246] Tx PACKET to $supernode_ip:9994 (dest=FF:FF:FF:FF:FF:FF) [85 B]
17/May/2020 16:53:45 [edge_utils.c:851] WARNING: Supernode not responding, now trying $supernode_domain:9994
17/May/2020 16:53:45 [edge_utils.c:861] Registering with supernode [id: 1/1][$supernode_domain:9994][attempts left 3]
17/May/2020 16:53:45 [edge_utils.c:779] Send REGISTER to 224.0.0.68:1968
17/May/2020 16:53:45 [edge_utils.c:1246] Tx PACKET to $supernode_ip:9994 (dest=FF:FF:FF:FF:FF:FF) [85 B]
17/May/2020 16:53:45 [edge_utils.c:1246] Tx PACKET to $supernode_ip:9994 (dest=FF:FF:FF:FF:FF:FF) [85 B]
17/May/2020 16:53:45 [edge_utils.c:1246] Tx PACKET to $supernode_ip:9994 (dest=FF:FF:FF:FF:FF:FF) [85 B]
17/May/2020 16:53:46 [edge_utils.c:1246] Tx PACKET to $supernode_ip:9994 (dest=FF:FF:FF:FF:FF:FF) [85 B]
17/May/2020 16:53:46 [edge_utils.c:1246] Tx PACKET to $supernode_ip:9994 (dest=FF:FF:FF:FF:FF:FF) [85 B]
17/May/2020 16:53:46 [edge_utils.c:1246] Tx PACKET to $supernode_ip:9994 (dest=FF:FF:FF:FF:FF:FF) [85 B]
17/May/2020 16:53:46 [edge_utils.c:1246] Tx PACKET to $supernode_ip:9994 (dest=FF:FF:FF:FF:FF:FF) [85 B]
17/May/2020 16:53:47 [edge_utils.c:1246] Tx PACKET to $supernode_ip:9994 (dest=FF:FF:FF:FF:FF:FF) [85 B]
17/May/2020 16:53:47 [edge_utils.c:1246] Tx PACKET to $supernode_ip:9994 (dest=FF:FF:FF:FF:FF:FF) [85 B]
17/May/2020 16:53:47 [edge_utils.c:1246] Tx PACKET to $supernode_ip:9994 (dest=FF:FF:FF:FF:FF:FF) [85 B]
17/May/2020 16:53:47 [edge_utils.c:1246] Tx PACKET to $supernode_ip:9994 (dest=FF:FF:FF:FF:FF:FF) [85 B]
17/May/2020 16:53:50 [edge_utils.c:1246] Tx PACKET to $supernode_ip:9994 (dest=FF:FF:FF:FF:FF:FF) [85 B]
17/May/2020 16:53:50 [edge_utils.c:861] Registering with supernode [id: 1/1][$supernode_domain:9994][attempts left 2]
17/May/2020 16:53:50 [edge_utils.c:779] Send REGISTER to 224.0.0.68:1968
17/May/2020 16:53:50 [edge_utils.c:1246] Tx PACKET to $supernode_ip:9994 (dest=FF:FF:FF:FF:FF:FF) [85 B]
17/May/2020 16:53:50 [edge_utils.c:1246] Tx PACKET to $supernode_ip:9994 (dest=FF:FF:FF:FF:FF:FF) [85 B]
17/May/2020 16:53:51 [edge_utils.c:1246] Tx PACKET to $supernode_ip:9994 (dest=FF:FF:FF:FF:FF:FF) [85 B]
17/May/2020 16:53:51 [edge_utils.c:1246] Tx PACKET to $supernode_ip:9994 (dest=FF:FF:FF:FF:FF:FF) [85 B]
17/May/2020 16:53:51 [edge_utils.c:1246] Tx PACKET to $supernode_ip:9994 (dest=FF:FF:FF:FF:FF:FF) [85 B]
17/May/2020 16:53:52 [edge.c:613] Shutting down...
17/May/2020 16:53:52 [edge_utils.c:1672] **********************************
17/May/2020 16:53:52 [edge_utils.c:1673] Packet stats:
17/May/2020 16:53:52 [edge_utils.c:1674]     TX P2P: 0 pkts
17/May/2020 16:53:52 [edge_utils.c:1675]     RX P2P: 0 pkts
17/May/2020 16:53:52 [edge_utils.c:1676]     TX Supernode: 72 pkts (72 broadcast)
17/May/2020 16:53:52 [edge_utils.c:1677]     RX Supernode: 0 pkts (0 broadcast)
17/May/2020 16:53:52 [edge_utils.c:1678] **********************************

```

**Comment by Logan007** [comment]
Could you please try to use supernode's explicit IP address instead of the domain name? I am not sure if the name resolution works within the edge. If i remember correctly, this feature was removed because it was the reason for some problems, e.g. stalling the edge.

_P. S._  If it works with IP only for you, you could use `$(dig +short yourDomainName):9994` (or so) instead. Just be aware that this will not re-resolve the domain name (in case of dynamic IP address) while edge is running.

**Comment by ileeoyo** [comment]
I tried to run edge with a explicit ip，nothing different.
edge recived 0 pkts.
supernode's log`update_edge created   1A:09:D6:2D:36:0E ==> $edge_ip:60857`

```
17/May/2020 18:39:42 [edge_utils.c:1943] Adding supernode[0] = $supernode_ip:9994
17/May/2020 18:39:42 [edge.c:678] Starting n2n edge 2.6.0 May 17 2020 16:42:41
17/May/2020 18:39:42 [edge.c:688] ip_mode='static'
17/May/2020 18:39:42 [tuntap_linux.c:200] Waiting for TAP interface to be up and running...
17/May/2020 18:39:42 [tuntap_linux.c:221] Interface is up and running
17/May/2020 18:39:42 [edge_utils.c:229] supernode 0 => $supernode_ip:9994
17/May/2020 18:39:42 [edge.c:724] Dropping privileges to uid=65534, gid=65534
17/May/2020 18:39:42 [edge.c:748] edge started
17/May/2020 18:39:42 [edge_utils.c:669] Successfully joined multicast group 224.0.0.68:1968
17/May/2020 18:39:42 [edge_utils.c:861] Registering with supernode [id: 1/1][$supernode_ip:9994][attempts left 2]
17/May/2020 18:39:42 [edge_utils.c:779] Send REGISTER to 224.0.0.68:1968
17/May/2020 18:39:47 [edge_utils.c:1246] Tx PACKET to $supernode_ip:9994 (dest=FF:FF:FF:FF:FF:FF) [85 B]
17/May/2020 18:39:47 [edge_utils.c:861] Registering with supernode [id: 1/1][$supernode_ip:9994][attempts left 1]
17/May/2020 18:39:47 [edge_utils.c:779] Send REGISTER to 224.0.0.68:1968
17/May/2020 18:39:48 [edge_utils.c:1246] Tx PACKET to $supernode_ip:9994 (dest=FF:FF:FF:FF:FF:FF) [85 B]
17/May/2020 18:39:49 [edge_utils.c:1246] Tx PACKET to $supernode_ip:9994 (dest=FF:FF:FF:FF:FF:FF) [85 B]
17/May/2020 18:39:52 [edge_utils.c:1246] Tx PACKET to $supernode_ip:9994 (dest=FF:FF:FF:FF:FF:FF) [85 B]
17/May/2020 18:39:52 [edge_utils.c:861] Registering with supernode [id: 1/1][$supernode_ip:9994][attempts left 0]
17/May/2020 18:39:52 [edge_utils.c:779] Send REGISTER to 224.0.0.68:1968
17/May/2020 18:39:52 [edge_utils.c:1246] Tx PACKET to $supernode_ip:9994 (dest=FF:FF:FF:FF:FF:FF) [85 B]
17/May/2020 18:39:52 [edge_utils.c:1246] Tx PACKET to $supernode_ip:9994 (dest=FF:FF:FF:FF:FF:FF) [85 B]
17/May/2020 18:39:52 [edge_utils.c:1246] Tx PACKET to $supernode_ip:9994 (dest=FF:FF:FF:FF:FF:FF) [85 B]
17/May/2020 18:39:53 [edge_utils.c:1246] Tx PACKET to $supernode_ip:9994 (dest=FF:FF:FF:FF:FF:FF) [85 B]
17/May/2020 18:39:53 [edge_utils.c:1246] Tx PACKET to $supernode_ip:9994 (dest=FF:FF:FF:FF:FF:FF) [85 B]
17/May/2020 18:39:53 [edge_utils.c:1246] Tx PACKET to $supernode_ip:9994 (dest=FF:FF:FF:FF:FF:FF) [85 B]
17/May/2020 18:39:53 [edge_utils.c:1246] Tx PACKET to $supernode_ip:9994 (dest=FF:FF:FF:FF:FF:FF) [85 B]
17/May/2020 18:39:54 [edge_utils.c:1246] Tx PACKET to $supernode_ip:9994 (dest=FF:FF:FF:FF:FF:FF) [85 B]
17/May/2020 18:39:54 [edge_utils.c:1246] Tx PACKET to $supernode_ip:9994 (dest=FF:FF:FF:FF:FF:FF) [85 B]
17/May/2020 18:39:54 [edge_utils.c:1246] Tx PACKET to $supernode_ip:9994 (dest=FF:FF:FF:FF:FF:FF) [85 B]
17/May/2020 18:39:54 [edge_utils.c:1246] Tx PACKET to $supernode_ip:9994 (dest=FF:FF:FF:FF:FF:FF) [85 B]
17/May/2020 18:39:57 [edge_utils.c:1246] Tx PACKET to $supernode_ip:9994 (dest=FF:FF:FF:FF:FF:FF) [85 B]
17/May/2020 18:39:57 [edge_utils.c:851] WARNING: Supernode not responding, now trying $supernode_ip:9994
17/May/2020 18:39:57 [edge_utils.c:861] Registering with supernode [id: 1/1][$supernode_ip:9994][attempts left 3]
17/May/2020 18:39:57 [edge_utils.c:779] Send REGISTER to 224.0.0.68:1968
17/May/2020 18:39:57 [edge_utils.c:1246] Tx PACKET to $supernode_ip:9994 (dest=FF:FF:FF:FF:FF:FF) [85 B]
17/May/2020 18:39:57 [edge_utils.c:1246] Tx PACKET to $supernode_ip:9994 (dest=FF:FF:FF:FF:FF:FF) [85 B]
17/May/2020 18:39:58 [edge_utils.c:1246] Tx PACKET to $supernode_ip:9994 (dest=FF:FF:FF:FF:FF:FF) [85 B]
17/May/2020 18:39:58 [edge_utils.c:1246] Tx PACKET to $supernode_ip:9994 (dest=FF:FF:FF:FF:FF:FF) [85 B]
17/May/2020 18:39:58 [edge_utils.c:1246] Tx PACKET to $supernode_ip:9994 (dest=FF:FF:FF:FF:FF:FF) [85 B]
17/May/2020 18:39:59 [edge_utils.c:1246] Tx PACKET to $supernode_ip:9994 (dest=FF:FF:FF:FF:FF:FF) [85 B]
17/May/2020 18:39:59 [edge_utils.c:1246] Tx PACKET to $supernode_ip:9994 (dest=FF:FF:FF:FF:FF:FF) [85 B]
17/May/2020 18:39:59 [edge_utils.c:1246] Tx PACKET to $supernode_ip:9994 (dest=FF:FF:FF:FF:FF:FF) [85 B]
17/May/2020 18:40:02 [edge_utils.c:1246] Tx PACKET to $supernode_ip:9994 (dest=FF:FF:FF:FF:FF:FF) [85 B]
17/May/2020 18:40:02 [edge_utils.c:861] Registering with supernode [id: 1/1][$supernode_ip:9994][attempts left 2]
17/May/2020 18:40:02 [edge_utils.c:779] Send REGISTER to 224.0.0.68:1968
17/May/2020 18:40:03 [edge_utils.c:1246] Tx PACKET to $supernode_ip:9994 (dest=FF:FF:FF:FF:FF:FF) [85 B]
17/May/2020 18:40:04 [edge_utils.c:1246] Tx PACKET to $supernode_ip:9994 (dest=FF:FF:FF:FF:FF:FF) [85 B]
17/May/2020 18:40:07 [edge_utils.c:1246] Tx PACKET to $supernode_ip:9994 (dest=FF:FF:FF:FF:FF:FF) [85 B]
17/May/2020 18:40:07 [edge_utils.c:861] Registering with supernode [id: 1/1][$supernode_ip:9994][attempts left 1]
17/May/2020 18:40:07 [edge_utils.c:779] Send REGISTER to 224.0.0.68:1968
17/May/2020 18:40:07 [edge_utils.c:1246] Tx PACKET to $supernode_ip:9994 (dest=FF:FF:FF:FF:FF:FF) [85 B]
17/May/2020 18:40:07 [edge_utils.c:1246] Tx PACKET to $supernode_ip:9994 (dest=FF:FF:FF:FF:FF:FF) [85 B]
17/May/2020 18:40:07 [edge_utils.c:1246] Tx PACKET to $supernode_ip:9994 (dest=FF:FF:FF:FF:FF:FF) [85 B]
17/May/2020 18:40:08 [edge_utils.c:1246] Tx PACKET to $supernode_ip:9994 (dest=FF:FF:FF:FF:FF:FF) [85 B]
17/May/2020 18:40:08 [edge_utils.c:1246] Tx PACKET to $supernode_ip:9994 (dest=FF:FF:FF:FF:FF:FF) [85 B]
17/May/2020 18:40:08 [edge_utils.c:1246] Tx PACKET to $supernode_ip:9994 (dest=FF:FF:FF:FF:FF:FF) [85 B]
17/May/2020 18:40:08 [edge_utils.c:1246] Tx PACKET to $supernode_ip:9994 (dest=FF:FF:FF:FF:FF:FF) [85 B]
17/May/2020 18:40:09 [edge_utils.c:1246] Tx PACKET to $supernode_ip:9994 (dest=FF:FF:FF:FF:FF:FF) [85 B]
17/May/2020 18:40:09 [edge_utils.c:1246] Tx PACKET to $supernode_ip:9994 (dest=FF:FF:FF:FF:FF:FF) [85 B]
17/May/2020 18:40:09 [edge_utils.c:1246] Tx PACKET to $supernode_ip:9994 (dest=FF:FF:FF:FF:FF:FF) [85 B]
17/May/2020 18:40:09 [edge_utils.c:1246] Tx PACKET to $supernode_ip:9994 (dest=FF:FF:FF:FF:FF:FF) [85 B]
17/May/2020 18:40:12 [edge_utils.c:1246] Tx PACKET to $supernode_ip:9994 (dest=FF:FF:FF:FF:FF:FF) [85 B]
17/May/2020 18:40:12 [edge_utils.c:861] Registering with supernode [id: 1/1][$supernode_ip:9994][attempts left 0]
17/May/2020 18:40:12 [edge_utils.c:779] Send REGISTER to 224.0.0.68:1968
17/May/2020 18:40:12 [edge_utils.c:1246] Tx PACKET to $supernode_ip:9994 (dest=FF:FF:FF:FF:FF:FF) [85 B]
17/May/2020 18:40:12 [edge_utils.c:1246] Tx PACKET to $supernode_ip:9994 (dest=FF:FF:FF:FF:FF:FF) [85 B]
17/May/2020 18:40:13 [edge_utils.c:1246] Tx PACKET to $supernode_ip:9994 (dest=FF:FF:FF:FF:FF:FF) [85 B]
17/May/2020 18:40:13 [edge_utils.c:1246] Tx PACKET to $supernode_ip:9994 (dest=FF:FF:FF:FF:FF:FF) [85 B]
17/May/2020 18:40:13 [edge_utils.c:1246] Tx PACKET to $supernode_ip:9994 (dest=FF:FF:FF:FF:FF:FF) [85 B]
17/May/2020 18:40:14 [edge_utils.c:1246] Tx PACKET to $supernode_ip:9994 (dest=FF:FF:FF:FF:FF:FF) [85 B]
17/May/2020 18:40:14 [edge_utils.c:1246] Tx PACKET to $supernode_ip:9994 (dest=FF:FF:FF:FF:FF:FF) [85 B]
17/May/2020 18:40:14 [edge_utils.c:1246] Tx PACKET to $supernode_ip:9994 (dest=FF:FF:FF:FF:FF:FF) [85 B]
17/May/2020 18:40:17 [edge_utils.c:1246] Tx PACKET to $supernode_ip:9994 (dest=FF:FF:FF:FF:FF:FF) [85 B]
17/May/2020 18:40:17 [edge_utils.c:851] WARNING: Supernode not responding, now trying $supernode_ip:9994
17/May/2020 18:40:17 [edge_utils.c:861] Registering with supernode [id: 1/1][$supernode_ip:9994][attempts left 3]
17/May/2020 18:40:17 [edge_utils.c:779] Send REGISTER to 224.0.0.68:1968
17/May/2020 18:40:18 [edge_utils.c:1246] Tx PACKET to $supernode_ip:9994 (dest=FF:FF:FF:FF:FF:FF) [85 B]
17/May/2020 18:40:19 [edge_utils.c:1246] Tx PACKET to $supernode_ip:9994 (dest=FF:FF:FF:FF:FF:FF) [85 B]
17/May/2020 18:40:22 [edge_utils.c:1246] Tx PACKET to $supernode_ip:9994 (dest=FF:FF:FF:FF:FF:FF) [85 B]
17/May/2020 18:40:22 [edge_utils.c:861] Registering with supernode [id: 1/1][$supernode_ip:9994][attempts left 2]
17/May/2020 18:40:22 [edge_utils.c:779] Send REGISTER to 224.0.0.68:1968
17/May/2020 18:40:22 [edge_utils.c:1246] Tx PACKET to $supernode_ip:9994 (dest=FF:FF:FF:FF:FF:FF) [85 B]
17/May/2020 18:40:22 [edge_utils.c:1246] Tx PACKET to $supernode_ip:9994 (dest=FF:FF:FF:FF:FF:FF) [85 B]
17/May/2020 18:40:22 [edge_utils.c:1246] Tx PACKET to $supernode_ip:9994 (dest=FF:FF:FF:FF:FF:FF) [85 B]
17/May/2020 18:40:22 [edge.c:613] Shutting down...
17/May/2020 18:40:22 [edge_utils.c:1672] **********************************
17/May/2020 18:40:22 [edge_utils.c:1673] Packet stats:
17/May/2020 18:40:22 [edge_utils.c:1674]     TX P2P: 0 pkts
17/May/2020 18:40:22 [edge_utils.c:1675]     RX P2P: 0 pkts
17/May/2020 18:40:22 [edge_utils.c:1676]     TX Supernode: 55 pkts (55 broadcast)
17/May/2020 18:40:22 [edge_utils.c:1677]     RX Supernode: 0 pkts (0 broadcast)
17/May/2020 18:40:22 [edge_utils.c:1678] **********************************

```

**Comment by Logan007** [comment]
Just to be sure: Was it you who replaced the `$supernode_ip` in the output afterwards for anonymity? Or is this the unmodified program output?

I am puzzled by the `FF:FF:FF:FF:FF:FF` MAC. Did you set it manually using `-m`? Or did you replace it in the output? Is the MAC `1A:09:D6:2D:36:0E` the one you manually set for that external edge?

**Comment by ileeoyo** [comment]
`$supernode_ip` is my supernode explicit ip.I replaced  it for anonymity manually 
I ran my edge without  a param  `-m`,and `FF:FF:FF:FF:FF:FF ` is this the unmodified program output
cmd: `sudo edge -a 10.0.0.30 -c example -k password -s 255.255.255.0 -l $supernode_ip:9994 -f -v`
thank a lot for your help

**Comment by Logan007** [comment]
From the `supernode`'s output, I am not able to tell if the `1A:09:D6:2D:36:0E` MAC is the (random) one from the external node or maybe from the other edge node running inside your internal home network as you do not use the `-m`. That would be another thing to check: Just set some distinct fixed MACs (one for intenal, another one for external) for testing. It would help to determine if the REGISTER_SUPER from that specific edge gets through. You would see where the REGISTER_SUPER gets send to, if you increased ` edge`'s verbosity by one level (`-vv` instead of `-v`).

From the external `edge`'s output, it seems that either it does not receive the REGISTER_SUPER_ACK (response from the `supernode` to a REGISTER_SUPER) or the supernode is not found at all. It might sound like a basic recipe, but could you please re-check your router settings? Is it really UDP you have forwarded?

**Comment by ileeoyo** [comment]
for this test,I stoped all edges except the external edge.
I am sure that there is a port forwarding for both tcp and udp on my main router.
useing `-vv`:

```
18/May/2020 09:27:46 [sn.c:826] traceLevel is 4
18/May/2020 09:27:46 [sn.c:836] supernode is listening on UDP 9994 (main)
18/May/2020 09:27:46 [sn.c:847] supernode is listening on UDP 5645 (management)
18/May/2020 09:27:46 [sn.c:850] supernode started
18/May/2020 09:27:56 [sn.c:934] timeout
18/May/2020 09:27:56 [n2n.c:317] Purging old registrations
18/May/2020 09:27:56 [n2n.c:322] Remove 0 registrations
18/May/2020 09:27:59 [sn.c:401] process_udp(34)
18/May/2020 09:27:59 [sn.c:589] Rx REGISTER_SUPER for BA:85:86:F6:65:A6 [$edge_ip:34750]
18/May/2020 09:27:59 [sn.c:128] update_edge for BA:85:86:F6:65:A6 [$edge_ip:34750]
18/May/2020 09:27:59 [sn.c:148] update_edge created   BA:85:86:F6:65:A6 ==> $edge_ip:34750
18/May/2020 09:27:59 [sn.c:600] Tx REGISTER_SUPER_ACK for BA:85:86:F6:65:A6 [$edge_ip:34750]
18/May/2020 09:28:05 [sn.c:401] process_udp(34)
18/May/2020 09:28:05 [sn.c:589] Rx REGISTER_SUPER for BA:85:86:F6:65:A6 [$edge_ip:34750]
18/May/2020 09:28:05 [sn.c:128] update_edge for BA:85:86:F6:65:A6 [$edge_ip:34750]
18/May/2020 09:28:05 [sn.c:167] update_edge unchanged BA:85:86:F6:65:A6 ==> $edge_ip:34750
18/May/2020 09:28:05 [sn.c:600] Tx REGISTER_SUPER_ACK for BA:85:86:F6:65:A6 [$edge_ip:34750]
18/May/2020 09:28:13 [sn.c:401] process_udp(34)
18/May/2020 09:28:13 [sn.c:589] Rx REGISTER_SUPER for BA:85:86:F6:65:A6 [$edge_ip:34750]
18/May/2020 09:28:13 [sn.c:128] update_edge for BA:85:86:F6:65:A6 [$edge_ip:34750]
18/May/2020 09:28:13 [sn.c:167] update_edge unchanged BA:85:86:F6:65:A6 ==> $edge_ip:34750
18/May/2020 09:28:13 [sn.c:600] Tx REGISTER_SUPER_ACK for BA:85:86:F6:65:A6 [$edge_ip:34750]
18/May/2020 09:28:23 [sn.c:934] timeout
18/May/2020 09:28:23 [sn.c:401] process_udp(34)
18/May/2020 09:28:23 [sn.c:589] Rx REGISTER_SUPER for BA:85:86:F6:65:A6 [$edge_ip:34750]
18/May/2020 09:28:23 [sn.c:128] update_edge for BA:85:86:F6:65:A6 [$edge_ip:34750]
18/May/2020 09:28:23 [sn.c:167] update_edge unchanged BA:85:86:F6:65:A6 ==> $edge_ip:34750
18/May/2020 09:28:23 [sn.c:600] Tx REGISTER_SUPER_ACK for BA:85:86:F6:65:A6 [$edge_ip:34750]
18/May/2020 09:28:30 [sn.c:401] process_udp(34)
18/May/2020 09:28:30 [sn.c:589] Rx REGISTER_SUPER for BA:85:86:F6:65:A6 [$edge_ip:34750]
18/May/2020 09:28:30 [sn.c:128] update_edge for BA:85:86:F6:65:A6 [$edge_ip:34750]
18/May/2020 09:28:30 [sn.c:167] update_edge unchanged BA:85:86:F6:65:A6 ==> $edge_ip:34750
18/May/2020 09:28:30 [sn.c:600] Tx REGISTER_SUPER_ACK for BA:85:86:F6:65:A6 [$edge_ip:34750]
18/May/2020 09:28:40 [sn.c:934] timeout
18/May/2020 09:28:40 [sn.c:401] process_udp(34)
18/May/2020 09:28:40 [sn.c:589] Rx REGISTER_SUPER for BA:85:86:F6:65:A6 [$edge_ip:34750]
18/May/2020 09:28:40 [sn.c:128] update_edge for BA:85:86:F6:65:A6 [$edge_ip:34750]
18/May/2020 09:28:40 [sn.c:167] update_edge unchanged BA:85:86:F6:65:A6 ==> $edge_ip:34750
18/May/2020 09:28:40 [sn.c:600] Tx REGISTER_SUPER_ACK for BA:85:86:F6:65:A6 [$edge_ip:34750]
18/May/2020 09:28:46 [sn.c:401] process_udp(34)
18/May/2020 09:28:46 [sn.c:589] Rx REGISTER_SUPER for BA:85:86:F6:65:A6 [$edge_ip:34750]
18/May/2020 09:28:46 [sn.c:128] update_edge for BA:85:86:F6:65:A6 [$edge_ip:34750]
18/May/2020 09:28:46 [sn.c:167] update_edge unchanged BA:85:86:F6:65:A6 ==> $edge_ip:34750
18/May/2020 09:28:46 [sn.c:600] Tx REGISTER_SUPER_ACK for BA:85:86:F6:65:A6 [$edge_ip:34750]
18/May/2020 09:28:56 [sn.c:934] timeout
18/May/2020 09:28:56 [n2n.c:317] Purging old registrations
18/May/2020 09:28:56 [n2n.c:322] Remove 0 registrations

```

```
18/May/2020 09:27:59 [edge_utils.c:1943] Adding supernode[0] = $supernode_ip:9994
18/May/2020 09:27:59 [edge.c:678] Starting n2n edge 2.6.0 May 17 2020 16:42:41
18/May/2020 09:27:59 [edge.c:688] ip_mode='static'
18/May/2020 09:27:59 [tuntap_linux.c:200] Waiting for TAP interface to be up and running...
18/May/2020 09:27:59 [tuntap_linux.c:221] Interface is up and running
18/May/2020 09:27:59 [edge_utils.c:229] supernode 0 => $supernode_ip:9994
18/May/2020 09:27:59 [edge_utils.c:1876] PMTU discovery disabled
18/May/2020 09:27:59 [edge.c:724] Dropping privileges to uid=65534, gid=65534
18/May/2020 09:27:59 [edge.c:748] edge started
18/May/2020 09:27:59 [edge_utils.c:669] Successfully joined multicast group 224.0.0.68:1968
18/May/2020 09:27:59 [edge_utils.c:861] Registering with supernode [id: 1/1][$supernode_ip:9994][attempts left 2]
18/May/2020 09:27:59 [edge_utils.c:708] send REGISTER_SUPER to $supernode_ip:9994
18/May/2020 09:27:59 [edge_utils.c:645] sendto sent=34 to 
18/May/2020 09:27:59 [edge_utils.c:376] Registering with multicast group 224.0.0.68:1968
18/May/2020 09:27:59 [edge_utils.c:779] Send REGISTER to 224.0.0.68:1968
18/May/2020 09:27:59 [edge_utils.c:645] sendto sent=36 to 
18/May/2020 09:27:59 [edge_utils.c:1757] Received packet from multicast socket
18/May/2020 09:27:59 [edge_utils.c:1474] ### Rx N2N UDP (36) from 192.168.1.136:34750
18/May/2020 09:27:59 [edge_utils.c:1537] Skipping REGISTER from self
18/May/2020 09:27:59 [n2n.c:281] Purging old registrations
18/May/2020 09:27:59 [n2n.c:286] Remove 0 registrations
18/May/2020 09:27:59 [n2n.c:281] Purging old registrations
18/May/2020 09:27:59 [n2n.c:286] Remove 0 registrations
18/May/2020 09:27:59 [edge_utils.c:1370] ### Rx TAP packet (  90) for 33:33:00:00:00:16
18/May/2020 09:27:59 [edge_utils.c:1379] Dropping TX multicast
18/May/2020 09:28:00 [edge_utils.c:1370] ### Rx TAP packet (  90) for 33:33:00:00:00:16
18/May/2020 09:28:00 [edge_utils.c:1379] Dropping TX multicast
18/May/2020 09:28:00 [edge_utils.c:1370] ### Rx TAP packet (  86) for 33:33:FF:F6:65:A6
18/May/2020 09:28:00 [edge_utils.c:1379] Dropping TX multicast
18/May/2020 09:28:01 [edge_utils.c:1370] ### Rx TAP packet (  90) for 33:33:00:00:00:16
18/May/2020 09:28:01 [edge_utils.c:1379] Dropping TX multicast
18/May/2020 09:28:01 [edge_utils.c:1370] ### Rx TAP packet (  70) for 33:33:00:00:00:02
18/May/2020 09:28:01 [edge_utils.c:1379] Dropping TX multicast
18/May/2020 09:28:01 [edge_utils.c:1370] ### Rx TAP packet (  90) for 33:33:00:00:00:16
18/May/2020 09:28:01 [edge_utils.c:1379] Dropping TX multicast
18/May/2020 09:28:05 [edge_utils.c:1370] ### Rx TAP packet (  70) for 33:33:00:00:00:02
18/May/2020 09:28:05 [edge_utils.c:1379] Dropping TX multicast
18/May/2020 09:28:05 [edge_utils.c:836] update_supernode_reg: doing fast retry.
18/May/2020 09:28:05 [edge_utils.c:861] Registering with supernode [id: 1/1][$supernode_ip:9994][attempts left 1]
18/May/2020 09:28:05 [edge_utils.c:708] send REGISTER_SUPER to $supernode_ip:9994
18/May/2020 09:28:05 [edge_utils.c:645] sendto sent=34 to 
18/May/2020 09:28:05 [edge_utils.c:376] Registering with multicast group 224.0.0.68:1968
18/May/2020 09:28:05 [edge_utils.c:779] Send REGISTER to 224.0.0.68:1968
18/May/2020 09:28:05 [edge_utils.c:645] sendto sent=36 to 
18/May/2020 09:28:05 [edge_utils.c:1757] Received packet from multicast socket
18/May/2020 09:28:05 [edge_utils.c:1474] ### Rx N2N UDP (36) from 192.168.1.136:34750
18/May/2020 09:28:05 [edge_utils.c:1537] Skipping REGISTER from self
18/May/2020 09:28:13 [edge_utils.c:1370] ### Rx TAP packet (  70) for 33:33:00:00:00:02
18/May/2020 09:28:13 [edge_utils.c:1379] Dropping TX multicast
18/May/2020 09:28:13 [edge_utils.c:836] update_supernode_reg: doing fast retry.
18/May/2020 09:28:13 [edge_utils.c:861] Registering with supernode [id: 1/1][$supernode_ip:9994][attempts left 0]
18/May/2020 09:28:13 [edge_utils.c:708] send REGISTER_SUPER to $supernode_ip:9994
18/May/2020 09:28:13 [edge_utils.c:645] sendto sent=34 to 
18/May/2020 09:28:13 [edge_utils.c:376] Registering with multicast group 224.0.0.68:1968
18/May/2020 09:28:13 [edge_utils.c:779] Send REGISTER to 224.0.0.68:1968
18/May/2020 09:28:13 [edge_utils.c:645] sendto sent=36 to 
18/May/2020 09:28:13 [edge_utils.c:1757] Received packet from multicast socket
18/May/2020 09:28:13 [edge_utils.c:1474] ### Rx N2N UDP (36) from 192.168.1.136:34750
18/May/2020 09:28:13 [edge_utils.c:1537] Skipping REGISTER from self
18/May/2020 09:28:23 [edge_utils.c:836] update_supernode_reg: doing fast retry.
18/May/2020 09:28:23 [edge_utils.c:851] WARNING: Supernode not responding, now trying $supernode_ip:9994
18/May/2020 09:28:23 [edge_utils.c:861] Registering with supernode [id: 1/1][$supernode_ip:9994][attempts left 3]
18/May/2020 09:28:23 [edge_utils.c:708] send REGISTER_SUPER to $supernode_ip:9994
18/May/2020 09:28:23 [edge_utils.c:645] sendto sent=34 to 
18/May/2020 09:28:23 [edge_utils.c:376] Registering with multicast group 224.0.0.68:1968
18/May/2020 09:28:23 [edge_utils.c:779] Send REGISTER to 224.0.0.68:1968
18/May/2020 09:28:23 [edge_utils.c:645] sendto sent=36 to 
18/May/2020 09:28:23 [edge_utils.c:1757] Received packet from multicast socket
18/May/2020 09:28:23 [edge_utils.c:1474] ### Rx N2N UDP (36) from 192.168.1.136:34750
18/May/2020 09:28:23 [edge_utils.c:1537] Skipping REGISTER from self
18/May/2020 09:28:30 [edge_utils.c:1370] ### Rx TAP packet (  70) for 33:33:00:00:00:02
18/May/2020 09:28:30 [edge_utils.c:1379] Dropping TX multicast
18/May/2020 09:28:30 [edge_utils.c:836] update_supernode_reg: doing fast retry.
18/May/2020 09:28:30 [edge_utils.c:861] Registering with supernode [id: 1/1][$supernode_ip:9994][attempts left 2]
18/May/2020 09:28:30 [edge_utils.c:708] send REGISTER_SUPER to $supernode_ip:9994
18/May/2020 09:28:30 [edge_utils.c:645] sendto sent=34 to 
18/May/2020 09:28:30 [edge_utils.c:376] Registering with multicast group 224.0.0.68:1968
18/May/2020 09:28:30 [edge_utils.c:779] Send REGISTER to 224.0.0.68:1968
18/May/2020 09:28:30 [edge_utils.c:645] sendto sent=36 to 
18/May/2020 09:28:30 [n2n.c:281] Purging old registrations
18/May/2020 09:28:30 [n2n.c:286] Remove 0 registrations
18/May/2020 09:28:30 [n2n.c:281] Purging old registrations
18/May/2020 09:28:30 [n2n.c:286] Remove 0 registrations
18/May/2020 09:28:30 [edge_utils.c:1757] Received packet from multicast socket
18/May/2020 09:28:30 [edge_utils.c:1474] ### Rx N2N UDP (36) from 192.168.1.136:34750
18/May/2020 09:28:30 [edge_utils.c:1537] Skipping REGISTER from self
18/May/2020 09:28:40 [edge_utils.c:836] update_supernode_reg: doing fast retry.
18/May/2020 09:28:40 [edge_utils.c:861] Registering with supernode [id: 1/1][$supernode_ip:9994][attempts left 1]
18/May/2020 09:28:40 [edge_utils.c:708] send REGISTER_SUPER to $supernode_ip:9994
18/May/2020 09:28:40 [edge_utils.c:645] sendto sent=34 to 
18/May/2020 09:28:40 [edge_utils.c:376] Registering with multicast group 224.0.0.68:1968
18/May/2020 09:28:40 [edge_utils.c:779] Send REGISTER to 224.0.0.68:1968
18/May/2020 09:28:40 [edge_utils.c:645] sendto sent=36 to 
18/May/2020 09:28:40 [edge_utils.c:1757] Received packet from multicast socket
18/May/2020 09:28:40 [edge_utils.c:1474] ### Rx N2N UDP (36) from 192.168.1.136:34750
18/May/2020 09:28:40 [edge_utils.c:1537] Skipping REGISTER from self
18/May/2020 09:28:46 [edge.c:613] Shutting down...
18/May/2020 09:28:46 [edge_utils.c:836] update_supernode_reg: doing fast retry.
18/May/2020 09:28:46 [edge_utils.c:861] Registering with supernode [id: 1/1][$supernode_ip:9994][attempts left 0]
18/May/2020 09:28:46 [edge_utils.c:708] send REGISTER_SUPER to $supernode_ip:9994
18/May/2020 09:28:46 [edge_utils.c:645] sendto sent=34 to 
18/May/2020 09:28:46 [edge_utils.c:376] Registering with multicast group 224.0.0.68:1968
18/May/2020 09:28:46 [edge_utils.c:779] Send REGISTER to 224.0.0.68:1968
18/May/2020 09:28:46 [edge_utils.c:645] sendto sent=36 to 
18/May/2020 09:28:46 [edge_utils.c:1672] **********************************
18/May/2020 09:28:46 [edge_utils.c:1673] Packet stats:
18/May/2020 09:28:46 [edge_utils.c:1674]     TX P2P: 0 pkts
18/May/2020 09:28:46 [edge_utils.c:1675]     RX P2P: 0 pkts
18/May/2020 09:28:46 [edge_utils.c:1676]     TX Supernode: 0 pkts (0 broadcast)
18/May/2020 09:28:46 [edge_utils.c:1677]     RX Supernode: 0 pkts (00 broadcast)
18/May/2020 09:28:46 [edge_utils.c:1678] **********************************

```

**Comment by Logan007** [comment]
Thank you for running it this way. The supernode receives the REGISTER_SUPER from the edge and in reply, the REGISTER_SUPER_ACK packet is sent from supernode to edge (so the supernode itself seems to work fine), but the edge never receives this packet.

My best guess it that maybe, there is a firewall (or iptables rule, or ...) on the external edge's computer?

**Comment by ileeoyo** [comment]
I checked my firewall.I'm so confused
```
Chain INPUT (policy ACCEPT)
target     prot opt source               destination         

Chain FORWARD (policy ACCEPT)
target     prot opt source               destination         
DOCKER-USER  all  --  0.0.0.0/0            0.0.0.0/0           
DOCKER-ISOLATION-STAGE-1  all  --  0.0.0.0/0            0.0.0.0/0           
ACCEPT     all  --  0.0.0.0/0            0.0.0.0/0            ctstate RELATED,ESTABLISHED
DOCKER     all  --  0.0.0.0/0            0.0.0.0/0           
ACCEPT     all  --  0.0.0.0/0            0.0.0.0/0           
ACCEPT     all  --  0.0.0.0/0            0.0.0.0/0           

Chain OUTPUT (policy ACCEPT)
target     prot opt source               destination         

Chain DOCKER (1 references)
target     prot opt source               destination         
ACCEPT     tcp  --  0.0.0.0/0            172.17.0.2           tcp dpt:6379
ACCEPT     tcp  --  0.0.0.0/0            172.17.0.3           tcp dpt:6379
ACCEPT     tcp  --  0.0.0.0/0            172.17.0.4           tcp dpt:443
ACCEPT     tcp  --  0.0.0.0/0            172.17.0.4           tcp dpt:22
ACCEPT     tcp  --  0.0.0.0/0            172.17.0.4           tcp dpt:80
ACCEPT     tcp  --  0.0.0.0/0            172.17.0.5           tcp dpt:8081

Chain DOCKER-ISOLATION-STAGE-1 (1 references)
target     prot opt source               destination         
DOCKER-ISOLATION-STAGE-2  all  --  0.0.0.0/0            0.0.0.0/0           
RETURN     all  --  0.0.0.0/0            0.0.0.0/0           

Chain DOCKER-ISOLATION-STAGE-2 (1 references)
target     prot opt source               destination         
DROP       all  --  0.0.0.0/0            0.0.0.0/0           
RETURN     all  --  0.0.0.0/0            0.0.0.0/0           

Chain DOCKER-USER (1 references)
target     prot opt source               destination         
RETURN     all  --  0.0.0.0/0            0.0.0.0/0           

```

**Comment by Logan007** [comment]
I am absolutely not too handy either with docker nor with iptables. You could try to use `edge`'s `-p <fixed port>` parameter and add a specific rule for that port to the iptables.

Is there anybody able to hint?

**Comment by ileeoyo** [comment]
udp dump info

```
➜  ~ sudo tcpdump -i enp0s3 udp port 9994 -vv
tcpdump: listening on enp0s3, link-type EN10MB (Ethernet), capture size 262144 bytes
15:34:49.302439 IP (tos 0x0, ttl 64, id 7484, offset 0, flags [none], proto UDP (17), length 62)
    192.168.1.136.51039 > SUPERNODE_IP.9994: [bad udp cksum 0x3a1b -> 0xe03e!] UDP, length 34
15:34:59.313985 IP (tos 0x0, ttl 64, id 7542, offset 0, flags [none], proto UDP (17), length 62)
    192.168.1.136.51039 > SUPERNODE_IP.9994: [bad udp cksum 0x3a1b -> 0x7cf1!] UDP, length 34
15:35:09.322064 IP (tos 0x0, ttl 64, id 8335, offset 0, flags [none], proto UDP (17), length 62)
    192.168.1.136.51039 > SUPERNODE_IP.9994: [bad udp cksum 0x3a1b -> 0x3e94!] UDP, length 34
15:35:19.332634 IP (tos 0x0, ttl 64, id 9374, offset 0, flags [none], proto UDP (17), length 62)
    192.168.1.136.51039 > SUPERNODE_IP.9994: [bad udp cksum 0x3a1b -> 0x9ca7!] UDP, length 34
15:35:29.342136 IP (tos 0x0, ttl 64, id 10199, offset 0, flags [none], proto UDP (17), length 62)
    192.168.1.136.51039 > SUPERNODE_IP.9994: [bad udp cksum 0x3a1b -> 0x3b1e!] UDP, length 34
```

```
➜  ~ sudo tcpdump -i enp0s3 udp port 51039 -vv
tcpdump: listening on enp0s3, link-type EN10MB (Ethernet), capture size 262144 bytes
15:32:45.343339 IP (tos 0x0, ttl 64, id 56061, offset 0, flags [none], proto UDP (17), length 62)
    192.168.1.136.51039 > SUPERNODE_IP.9994: [bad udp cksum 0x3a1b -> 0x5e91!] UDP, length 34
15:32:45.343422 IP (tos 0x0, ttl 1, id 39409, offset 0, flags [none], proto UDP (17), length 64)
    192.168.1.136.51039 > 224.0.0.68.1968: [bad udp cksum 0xa2b2 -> 0x4cbb!] UDP, length 36
15:32:55.355319 IP (tos 0x0, ttl 64, id 58203, offset 0, flags [none], proto UDP (17), length 62)
    192.168.1.136.51039 > SUPERNODE_IP.9994: [bad udp cksum 0x3a1b -> 0xadcb!] UDP, length 34
15:32:55.355399 IP (tos 0x0, ttl 1, id 41685, offset 0, flags [none], proto UDP (17), length 64)
    192.168.1.136.51039 > 224.0.0.68.1968: [bad udp cksum 0xa2b2 -> 0x4cbb!] UDP, length 36
15:33:05.366724 IP (tos 0x0, ttl 64, id 60095, offset 0, flags [none], proto UDP (17), length 62)
    192.168.1.136.51039 > SUPERNODE_IP.9994: [bad udp cksum 0x3a1b -> 0xd2d2!] UDP, length 34
15:33:05.366801 IP (tos 0x0, ttl 1, id 43245, offset 0, flags [none], proto UDP (17), length 64)
    192.168.1.136.51039 > 224.0.0.68.1968: [bad udp cksum 0xa2b2 -> 0x4cbb!] UDP, length 36
15:33:15.376834 IP (tos 0x0, ttl 64, id 60285, offset 0, flags [none], proto UDP (17), length 62)
```

**Comment by ileeoyo** [comment]
there is some tcpdump info on the router that running a supernode, no udp response.I think there are some bugs
```
root@OpenWrt:~#  tcpdump udp port 9994 -n -i eth0
tcpdump: verbose output suppressed, use -v or -vv for full protocol decode
listening on eth0, link-type EN10MB (Ethernet), capture size 262144 bytes
18:30:28.370153 IP $PUBLIC_IP.53348 > 192.168.2.4.9994: UDP, length 34
18:30:28.382100 IP $PUBLIC_IP.53348 > 192.168.2.4.9994: UDP, length 92
18:30:28.690247 IP $PUBLIC_IP.53348 > 192.168.2.4.9994: UDP, length 76
18:30:29.340336 IP $PUBLIC_IP.53348 > 192.168.2.4.9994: UDP, length 92
18:30:29.700405 IP $PUBLIC_IP.53348 > 192.168.2.4.9994: UDP, length 76
18:30:30.341557 IP $PUBLIC_IP.53348 > 192.168.2.4.9994: UDP, length 92
18:30:30.691640 IP $PUBLIC_IP.53348 > 192.168.2.4.9994: UDP, length 76
```

but when I run edge on a computer in the LAN,there's some udp response
```
root@OpenWrt:~#  tcpdump udp port 9994 -n -i eth0
18:26:50.110728 IP 192.168.2.2.60142 > 192.168.2.4.9994: UDP, length 34
18:26:50.111349 IP 192.168.2.4.9994 > 192.168.2.2.60142: UDP, length 41
18:26:50.123756 IP 192.168.2.2.60142 > 192.168.2.4.9994: UDP, length 92
18:26:50.188727 IP 192.168.2.2.60142 > 192.168.2.4.9994: UDP, length 76
18:26:50.189311 IP 192.168.2.4.9994 > 192.168.2.2.60142: UDP, length 84
18:26:51.092996 IP 192.168.2.2.60142 > 192.168.2.4.9994: UDP, length 92
18:26:51.189030 IP 192.168.2.2.60142 > 192.168.2.4.9994: UDP, length 76
18:26:51.189632 IP 192.168.2.4.9994 > 192.168.2.2.60142: UDP, length 84
```

**Comment by Logan007** [comment]
Has this already been solved?

**Comment by Logan007** [comment]
Considered deprecated, please re-open if required.
