### ISSUE TITLE
ISP change port fast.

### ISSUE THREAD

**Issue by lunarjoll** [ntop/n2n#61]
23:31:09.522852 IP person_IP.13108 > vps.localdomain.ndmp: UDP, length 85
23:31:09.523433 IP vps.localdomain.ndmp > person_IP.12978: UDP, length 93
23:31:10.562929 IP person_IP.13108 > vps.localdomain.ndmp: UDP, length 85
23:31:10.563471 IP vps.localdomain.ndmp > person_IP.12978: UDP, length 93

port 13108 is used now; port 12978 is register before.
Can you update n2n to use newest port?

**Comment by emanuele-f** [comment]
Do you mean the supernode port? Please be more explicative

**Comment by lunarjoll** [comment]
supernode install in vps, it receive from port 13108, but sent data to port 12978. Then I can’t receive data until register supernode . Then ISP change my port again.

**Comment by lunarjoll** [comment]
State      Recv-Q      Send-Q               Local Address:Port                Peer Address:Port                                                   
UNCONN     0           0                          0.0.0.0:ndmp                     0.0.0.0:*          users:(("supernode",pid=11523,fd=3))        
UNCONN     0           0                        127.0.0.1:323                      0.0.0.0:*          users:(("chronyd",pid=518,fd=5))            
UNCONN     0           0                          0.0.0.0:lipsinc                  0.0.0.0:*          users:(("edge",pid=11750,fd=6))             
UNCONN     0           0                          0.0.0.0:42970                    0.0.0.0:*          users:(("edge",pid=11750,fd=4))             
UNCONN     0           0                        127.0.0.1:5644                     0.0.0.0:*          users:(("edge",pid=11750,fd=5))             
UNCONN     0           0                        127.0.0.1:5645                     0.0.0.0:*          users:(("supernode",pid=11523,fd=4))  

Is it usefull to open port 5644 5645 42970 which listening from edge?

**Comment by emanuele-f** [comment]
In order to make the supernode reachable from the outside, you only need to open the port the supernode is listening on. For example, if the supernode is using `-l=7777` then you only need to open port 7777. You need to setup port forwarding on the router. If your ISP does not support this than you should install the supernode elsewhere, for example a vps.

**Comment by lunarjoll** [comment]
Is there a way to fast register person_IP's port. 

13/Feb/2019 19:01:07 [edge_utils.c:609] Registering with supernode [id: 1/1][vps_IP:10000][attempts left 2]
13/Feb/2019 19:01:07 [edge_utils.c:1395] Rx REGISTER_SUPER_ACK myMAC=BA:04:3A:85:55:B9 [vps_IP:10000] (external person_IP:13618). Attempts 2
13/Feb/2019 19:03:16 [edge_utils.c:609] Registering with supernode [id: 1/1][vps_IP:10000][attempts left 2]
13/Feb/2019 19:03:16 [edge_utils.c:1395] Rx REGISTER_SUPER_ACK myMAC=BA:04:3A:85:55:B9 [vps_IP:10000] (external person_IP:12593). Attempts 2
13/Feb/2019 19:05:16 [edge_utils.c:609] Registering with supernode [id: 1/1][vps_IP:10000][attempts left 2]
13/Feb/2019 19:05:16 [edge_utils.c:1395] Rx REGISTER_SUPER_ACK myMAC=BA:04:3A:85:55:B9 [vps_IP:10000] (external person_IP:12803). Attempts 2
13/Feb/2019 19:07:16 [edge_utils.c:609] Registering with supernode [id: 1/1][vps_IP:10000][attempts left 2]
13/Feb/2019 19:07:16 [edge_utils.c:1395] Rx REGISTER_SUPER_ACK myMAC=BA:04:3A:85:55:B9 [vps_IP:10000] (external person_IP:12803). Attempts 2

**Comment by lunarjoll** [comment]
Is it possible to make supernode auto register, when found edge port has change.

I think it is useful in mobile network, which ISP change IP and port faster.

**Comment by emanuele-f** [comment]
After #71, registration now occurs every 15 seconds
